{
  "id": "suzuki-motor-corporation-record",
  "ownerIds": [
    "suzuki-motor-corporation"
  ],
  "text": "Suzuki Motor Corporation is a Tokyo-listed automaker with a dispersed Japanese institutional shareholder base and no state ownership; its Annual Securities Report shows no government holder of note. The Torino FC front sponsorship is private corporate money. Human-rights exposure is ordinary auto-supply-chain and Gujarat/India manufacturing labour issues.",
  "short": "Suzuki Motor Corporation is a Tokyo-listed automaker with a dispersed Japanese institutional shareholder base and no state ownership; its Annual Securities Report….",
  "source": {
    "name": "Suzuki Motor Corporation, Annual Securities Report FY2025",
    "date": "2025-06",
    "url": "https://www.globalsuzuki.com/ir/library/asr/pdf/asr_fy2025.pdf"
  },
  "reviewed": false
}
