{
  "id": "occidental-petroleum-owner-record",
  "ownerIds": [
    "occidental-petroleum-owner"
  ],
  "text": "Occidental Petroleum Corporation is a publicly traded company listed on the New York Stock Exchange under ticker OXY.",
  "short": "Occidental Petroleum Corporation is a publicly traded company listed on the New York Stock Exchange under ticker OXY.",
  "source": {
    "name": "SEC DEF 14A for Occidental Petroleum Corporation",
    "date": "2026-03-19",
    "url": "https://www.sec.gov/Archives/edgar/data/797468/000162828026019816/oxy-20260319.htm"
  },
  "reviewed": true
}
