{
  "id": "american-airlines-owner-record",
  "ownerIds": [
    "american-airlines-owner"
  ],
  "text": "American Airlines Group Inc. is owned by American Airlines. No state shareholder identified. Ownership sits with public institutional and retail investors, so the sponsorship money is purely private capital.",
  "short": "American Airlines Group Inc.",
  "source": {
    "name": "American Airlines Group Inc. DEF 14A 2026 (SEC)",
    "date": "2026-04-28",
    "url": "https://www.sec.gov/Archives/edgar/data/6201/000119312526187096/d83928ddef14a.htm"
  },
  "reviewed": false
}
