{
  "id": "yeti-holdings-inc-record",
  "ownerIds": [
    "yeti-holdings-inc"
  ],
  "text": "YETI Holdings, Inc. is NYSE-listed (YETI) with a dispersed shareholder base and no state owner. The Austin FC front sponsorship is private corporate money. Human-rights relevance is ordinary consumer-goods supply-chain labour exposure.",
  "short": "YETI Holdings, Inc.",
  "source": {
    "name": "YETI Holdings, Inc. Form 10-K FY2025 (SEC EDGAR)",
    "date": "2026-02-27",
    "url": "https://www.sec.gov/Archives/edgar/data/1670592/000167059226000013/yeti-20260103.htm"
  },
  "reviewed": false
}
