{
  "id": "paze-owner-record",
  "ownerIds": [
    "paze-owner"
  ],
  "text": "Early Warning Services, LLC is co-owned by seven major U.S. banks: Bank of America, Capital One, JPMorgan Chase, PNC Bank, Truist, U.S. Bank and Wells Fargo.",
  "short": "Early Warning Services, LLC is co-owned by seven major U.S.",
  "source": {
    "name": "Consumer Financial Protection Bureau webpage",
    "date": "2026-09-24",
    "url": "https://www.consumerfinance.gov/consumer-tools/credit-reports-and-scores/consumer-reporting-companies/companies-list/early-warning-services-llc/"
  },
  "reviewed": true
}
