{
  "id": "hansemerkur-krankenversicherung-ag-record",
  "ownerIds": [
    "hansemerkur-krankenversicherung-ag"
  ],
  "text": "HanseMerkur is Germany's only independent, group-independent mid-sized personal insurer in Hamburg and is structured as a Versicherungsverein auf Gegenseitigkeit (mutual); HanseMerkur Krankenversicherung auf Gegenseitigkeit remains the owner of the group, owing duties only to customers and staff, not shareholders.",
  "short": "HanseMerkur is Germany's only independent, group-independent mid-sized personal insurer in Hamburg and is structured as a Versicherungsverein auf Gegenseitigkeit….",
  "source": {
    "name": "HanseMerkur official company/facts page (mutual structure); HanseMerkur 150-year corporate history",
    "date": "2025",
    "url": "https://vertriebskarriere.hansemerkur.de/das-unternehmen/zahlen-fakten"
  },
  "reviewed": true
}
