{
  "id": "extreme-networks-inc-record",
  "ownerIds": [
    "extreme-networks-inc"
  ],
  "text": "Extreme Networks, Inc. (Nasdaq: EXTR) is the Audi Revolut F1 Team partner: a US networking vendor listed on Nasdaq with dispersed institutional ownership and no parent company, family control or state stake. Human-rights relevance is limited to ordinary supply-chain and hardware-sourcing exposure.",
  "short": "Extreme Networks, Inc.",
  "source": {
    "name": "Extreme Networks Investor Relations - corporate overview",
    "date": "2026-09-25",
    "url": "https://investor.extremenetworks.com/"
  },
  "reviewed": false
}
