{
  "id": "energy-transfer-owner-record",
  "ownerIds": [
    "energy-transfer-owner"
  ],
  "text": "Energy Transfer LP is a publicly traded master limited partnership; no single person or company owns it outright, with public unitholders holding the majority of economic interest.",
  "short": "Energy Transfer LP is a publicly traded master limited partnership; no single person or company owns it outright, with public unitholders holding the majority of….",
  "source": {
    "name": "LegalClarity article on Energy Transfer ownership",
    "date": "2026-09-24",
    "url": "https://legalclarity.org/who-owns-energy-transfer-investors-and-insiders"
  },
  "reviewed": true
}
