{
  "id": "judi-health-owner-record",
  "ownerIds": [
    "judi-health-owner"
  ],
  "text": "Judi Health is owned by Judi Health. No state shareholder identified. Ownership sits with public institutional and retail investors, so the sponsorship money is purely private capital.",
  "short": "Judi Health is owned by Judi Health.",
  "source": {
    "name": "Judi Health press release on $400M funding round",
    "date": "2025-09-23",
    "url": "https://judi.health/insights/capital-rx-announces-funding-round-of-400m-to-accelerate-ai-powered-health-benefits-platform-rebrands-as-judi-health-to-reflect-expansion-beyond-pharmacy"
  },
  "reviewed": true
}
