{
  "id": "tpg-record",
  "ownerIds": [
    "tpg"
  ],
  "text": "DirecTV is now wholly owned by TPG Capital, the US/European private-equity platform of TPG Inc., which completed its purchase of AT&T's remaining 70% stake on 2 July 2025 and made DIRECTV a wholly owned portfolio company. Ownership is purely private equity with no state stake. Human-rights relevance is ordinary media/consumer labour and contractor conduct.",
  "short": "DirecTV is now wholly owned by TPG Capital, the US/European private-equity platform of TPG Inc., which completed its purchase of AT&T's remaining 70% stake on 2….",
  "source": {
    "name": "TPG - 'TPG Completes Acquisition of AT&T's 70% Stake in DIRECTV'",
    "date": "2025-07-02",
    "url": "https://shareholders.tpg.com/news-releases/news-release-details/tpg-completes-acquisition-atts-70-stake-directv/"
  },
  "reviewed": true
}
