{
  "id": "uralchem-record",
  "ownerIds": [
    "uralchem"
  ],
  "text": "Uralkali's controlling shareholder is Uralchem PJSC, which holds 81.47% of Uralkali; Uralchem is a private company, with Dmitry Mazepin previously holding 100% and selling a controlling 52% stake in 2022. No direct Russian state or state-fund stake is documented, so the ultimate owner is a private Russian holding.",
  "short": "Uralkali's controlling shareholder is Uralchem PJSC, which holds 81.47% of Uralkali; Uralchem is a private company, with Dmitry Mazepin previously holding 100% and….",
  "source": {
    "name": "Fitch Ratings (rating action recording Uralchem's 81.47% stake); Reuters (Mazepin sells controlling stake in Uralchem)",
    "date": "2021-10-05 / 2022",
    "url": "https://www.fitchratings.com/research/corporate-finance/fitch-revises-uralkali-outlook-to-negative-affirms-at-bb-05-10-2021"
  },
  "reviewed": true
}
