{
  "id": "bank-of-montreal-record",
  "ownerIds": [
    "bank-of-montreal"
  ],
  "text": "Bank of Montreal (BMO) is a Canadian chartered bank listed in Toronto and New York with no state shareholder. Canadian law caps concentration: under the Bank Act no person may be a 'major shareholder' - more than 20% of any class of voting shares - of a bank of BMO's size, and none is, so the bank is institutionally dispersed by statute. Record is unremarkable; relevance is ordinary banking conduct.",
  "short": "Bank of Montreal (BMO) is a Canadian chartered bank listed in Toronto and New York with no state shareholder.",
  "source": {
    "name": "Bank of Montreal Annual Information Form for the year ended 31 October 2025 (SEC 40-F Exhibit 99.1)",
    "date": "2025-12-04",
    "url": "https://www.sec.gov/Archives/edgar/data/927971/000119312525307982/d938207dex991.htm"
  },
  "reviewed": true
}
