{
  "id": "osceola-county-tourism-authority-record",
  "ownerIds": [
    "osceola-county-tourism-authority"
  ],
  "text": "Experience Kissimmee is not a company: it is the official destination marketing authority for Osceola County, Florida, funded from the county's Tourist Development Tax and governed under the state Local Option Tourist Development Act.",
  "short": "Experience Kissimmee is not a company: it is the official destination marketing authority for Osceola County, Florida, funded from the county's Tourist Development….",
  "source": {
    "name": "Experience Kissimmee - About us (official tourism authority for Osceola County)",
    "date": "2026-09-25",
    "url": "https://experiencekissimmee.com/about-us"
  },
  "reviewed": false
}
