{
  "id": "cote-divoire-hrw-record",
  "ownerIds": [
    "government-of-cote-divoire"
  ],
  "text": "Human Rights Watch said Ivorian authorities should investigate the killing of more than 50 people in the violence around the October 2020 presidential election, with a dozen opposition leaders arrested and justice for the 2010-11 crisis still incomplete.",
  "source": {
    "name": "Human Rights Watch — Côte d'Ivoire, 'Post-Election Violence, Repression'",
    "date": "2020-12-02",
    "url": "https://www.hrw.org/africa/cote-divoire"
  },
  "reviewed": true
}
